mixtral_query,mixtral_positive match,mixtral_llm match,mixtral_gt match,mixtral_resolution positive match,mixtral_resolution llm match,mixtral_resolution gt match,mixtral_ambiguity similarity match,mixtral_resolution similarity match
"in terms of the readings, group the similar timestamps for the sants",Ambiguity found by both llm and gt,,,,Resolution found by llm only,,0.34009477,
"for o3, what is the distribution value",,,,,,,,
"in the whole table, show me the best record of pm10",,,Ambiguity found by gt only,,,Resolution found by gt only,,
"based on their pollution, group the locations together that are similar",Ambiguity found by both llm and gt,,,,Resolution found by llm only,,0.65743804,
please look at the o3 data and find the minimum number,,,Ambiguity found by gt only,,,Resolution found by gt only,,
in what manner are good air quality records dispersed throughout the monitored region,Ambiguity found by both llm and gt,,,Resolution found by both llm and gt,,,0.56109554,0.19328305
are there any outliers in pm10 readings from a temporal perspective,Ambiguity found by both llm and gt,,,Resolution found by both llm and gt,,,0.16209064,0.29522964
work out the quality of o3,Ambiguity found by both llm and gt,,,,Resolution found by llm only,,0.54195637,
put the readings in order according to their pm 10 values,,,,,,,,
is distribution for pm10 value anything other than normal,,,,,,,,
show me a day with extremely bad air quality,Ambiguity found by both llm and gt,,,Resolution found by both llm and gt,,,0.2342507,0.06565342
what days had really bad air quality,Ambiguity found by both llm and gt,,,Resolution found by both llm and gt,,,0.47816962,0.7039965
give me the count of missing readings in this table,,,,,,,,
"show me the data attribute that has the most na values, for example the hardest data points to collect",,,,,,,,
describe the change in air quality over one day describe the change in each air pollutant,,Ambiguity found by llm only,,,Resolution found by llm only,,,
could you search all available values for pm10 quality,,,,,,,,
are the o3 value and the pm10 value dependent on each other,,,,,,,,
"across the monitored region, what is the distribution of records for good air quality",,,Ambiguity found by gt only,,,Resolution found by gt only,,
what months are hurricanes most common,,Ambiguity found by llm only,,,Resolution found by llm only,,,
where are storms most common depending on the time of year,,Ambiguity found by llm only,,,Resolution found by llm only,,,
are there more storms in recent years,,Ambiguity found by llm only,,,Resolution found by llm only,,,
what does the distribution of the storms look like,,,,,,,,
what is the most frequent status over the year,,,,,,,,
"what is the main factor depending on different status (wind, time, pressure, or etc)",,,Ambiguity found by gt only,,,Resolution found by gt only,,
what was the name of the earliest storm,,,,,,,,
how many hurricanes,,,,,,,,
what is the name of the largest storm,,,Ambiguity found by gt only,,,Resolution found by gt only,,
what storm produced the greatest air pressure,,,,,,,,
how many storms are named caroline,,,,,,,,
what storm produced the least air pressure,,,,,,,,
what storm had the greatest diameter of tropical storm strength winds,,,,,,,,
what storm had the greatest diameter of hurricane strength winds,,Ambiguity found by llm only,,,Resolution found by llm only,,,
"how many storms occur per year, on average",,,,,,,,
"on average, what is the first date that a tropical cyclone (tropical depression, tropical storm, or hurricane) forms on every year",,,Ambiguity found by gt only,,,Resolution found by gt only,,
is there a correlation between wind speed and air pressure,,,,,,,,
is there a correlation between the duration of the storm and wind speed,,Ambiguity found by llm only,,,Resolution found by llm only,,,
where have all hurricanes been recorded on the globe where are they more common,,Ambiguity found by llm only,,,Resolution found by llm only,,,
what lat/long locations are most likely to experience hurricanes,,,,,,,,
what are lengths/timings of hurricane seasons in different regions of the world,,Ambiguity found by llm only,,,Resolution found by llm only,,,
what is the average storm length,Ambiguity found by both llm and gt,,,Resolution found by both llm and gt,,,0.49248755,0.32894176
what is the average time that it takes to go from depression to storm,,,,,,,,
"what is the relationship, if any, between wind and pressure",,,,,,,,
how does wind change over the course of each hurricane,,,,,,,,
average tropical storm diameter,,Ambiguity found by llm only,,,Resolution found by llm only,,,
what is the relationship between storm day and hu_diameter,,,,,,,,
are there any repeat names of storms,,,,,,,,
what month has the strongest hurricanes,Ambiguity found by both llm and gt,,,Resolution found by both llm and gt,,,0.36089098,0.12261057
how has wind speed changed over time,,Ambiguity found by llm only,,,Resolution found by llm only,,,
what is the maximum pressure of a certain hurricane,,Ambiguity found by llm only,,,Resolution found by llm only,,,
relationship between position and the strength of the hurricane,Ambiguity found by both llm and gt,,,Resolution found by both llm and gt,,,0.391869,0.38728973
average time for each hurricane status,,,,,,,,
which hurricane lasted the longest,,Ambiguity found by llm only,,,Resolution found by llm only,,,
can you tell me the sales distribution of type 4046 in 2015,,Ambiguity found by llm only,,,Resolution found by llm only,,,
what are the groups of regions according to three types of avocados sales ratio,Ambiguity found by both llm and gt,,,Resolution found by both llm and gt,,,0.7738484,0.20771372
"using the three types of avocado's sales ratio, provide the groups of regions",Ambiguity found by both llm and gt,,,Resolution found by both llm and gt,,,0.33370817,0.080450594
provide the distribution of the sales in 2015 of type 4046,,,,,,,,
the oldest user was born in what year,,,,,,,,
indicate all the travels taking more than 1000 minutes,,,,,,,,
"show me a list of the tripe that take longer than 1,000 minutes",,,,,,,,
tell me the distribution of travel times between wells st & elm st and lake shore dr & ohio st,,,,,,,,
show me the relationship between age and travel time,,,,,,,,
do you know of any trip that would take longer than 1000 minutes,,,,,,,,
show me a list of neighborhoods with the number of male births from least to most,,,Ambiguity found by gt only,,,Resolution found by gt only,,
show me the distribution of births across all districts in 2017,,,Ambiguity found by gt only,,,Resolution found by gt only,,
let me know if there are groups of neighborhoods with similar birth gender ratios,,Ambiguity found by llm only,,,Resolution found by llm only,,,
retrieve the neighborhood with more than 100 female births in ciutat vella in 2013,Ambiguity found by both llm and gt,,,Resolution found by both llm and gt,,,0.18622428,0.1928654
which neighborhood in ciutat vella has more than 100 females born in the year 2013,,Ambiguity found by llm only,,,Resolution found by llm only,,,
"barcelona's districts, please list each",,,Ambiguity found by gt only,,,Resolution found by gt only,,
what is the distribution of all births in all districts between 2013 and 2017,,,,,,,,
what neighborhood had 56 boys born in 2017,,,Ambiguity found by gt only,,,Resolution found by gt only,,
is there a correlation between acceleration and horsepower,,Ambiguity found by llm only,,,Resolution found by llm only,,,
how many heavy cars are in the dataset,Ambiguity found by both llm and gt,,,Resolution found by both llm and gt,,,0.63311064,0.4015559
are there any american 5 cylinder cars,,,,,,,,
how does displacement relate to fuel economy for cars from europe v usa,,,,,,,,
which cylinder cars have the highest fuel economy,,,,,,,,
which countries have the most cars in this dataset,,Ambiguity found by llm only,,,Resolution found by llm only,,,
which countries have the highest acceleration for cars of different cylinders,,Ambiguity found by llm only,,,Resolution found by llm only,,,
how do the horsepowers of the cars from different regions change with years,,Ambiguity found by llm only,,,Resolution found by llm only,,,
the distribution of the number of cylinders of cars based on different origins,,Ambiguity found by llm only,,,Resolution found by llm only,,,
what is the correlation between displacement and mpg of cars with different origins,,,,,,,,
count the number of cars based on their origins,,,,,,,,
what is the correlation between horsepower and acceleration,,,,,,,,
is there a correlation between cars' horsepower and acceleration,,,,,,,,
"how does displacement relate to mpg for individual models, partitioned by country",,Ambiguity found by llm only,,,Resolution found by llm only,,,
"how does weight relate to acceleration for car models, small multiples by origin",,Ambiguity found by llm only,,,Resolution found by llm only,,,
how does horsepower relate to acceleration for individual car models,,Ambiguity found by llm only,,,Resolution found by llm only,,,
"compare the number of models in usa, japan and europe",,,,,,,,
does higher horsepower mean lower acceleration,,,,,,,,
how many cylinders do cars manufactured in different countries have,,,,,,,,
compare car cylinder count against acceleration across countries,,Ambiguity found by llm only,,,Resolution found by llm only,,,
how many cars do each country manufacture,,,,,,,,
what's the mileage for cars based on the number of cylinders present,,,Ambiguity found by gt only,,,Resolution found by gt only,,
does higher cylinder count mean mean lower mileage,,,Ambiguity found by gt only,,,Resolution found by gt only,,
how does mileage relate to cylinder count,,,Ambiguity found by gt only,,,Resolution found by gt only,,
what is the average mpg for different cylinders,,,,,,,,
what is the relation between horsepower and acceleration,,,,,,,,
how weight varies each year,,Ambiguity found by llm only,,,Resolution found by llm only,,,
how is acceleration related to horsepower,,,,,,,,
how has horsepower changed over time by country,,Ambiguity found by llm only,,,Resolution found by llm only,,,
have cars gotten lighter over time,,,,,,,,
how many models are proudced by each country,,Ambiguity found by llm only,,,Resolution found by llm only,,,
what is the average weight of cars over time,,Ambiguity found by llm only,,,Resolution found by llm only,,,
what is the distribution of weight across all cars,,,,,,,,
how much do various cars weigh,,,,,,,,
what is the range of weights for all cars,,,,,,,,
where do the cars originate from,,,,,,,,
how has avg (horsepower) evolved over time | segregate it by the car origin,,Ambiguity found by llm only,,,Resolution found by llm only,,,
compare avg (acceleration) with cylinders | segregate the cylinders by their origin,,Ambiguity found by llm only,,,Resolution found by llm only,,,
how does avg (weight) evolve over the years,,,,,,,,
how does the acceleration of cars from different countries vary by the number of cylinders,,Ambiguity found by llm only,,,Resolution found by llm only,,,
how does acceleration vary by weight for cars from different regions,,Ambiguity found by llm only,,,,,,
what is the average mpg for cars with different cylinders,,,,,,,,
how does mpg vary by the number of cylinders in a car,,,,,,,,
how does acceleration change with horsepower,,,,,,,,
how does acceleration behave compared to horsepower,,,,,,,,
how many cars are from each region,,,,,,,,
"how does mpg compare to displacement, broken out by region",,,,,,,,
"for each region, how does a car's mpg vary with displacement",,Ambiguity found by llm only,,,Resolution found by llm only,,,
how has horsepower changed over time in each region,,,,,,,,
what is the breakdown of cars by the number of cylinders in each region,,,,,,,,
how many cars have various numbers of cylinders in each region,,,,,,,,
what is the average weight of cars by model year,,,,,,,,
how has the average weight of cars changed over the years,,,,,,,,
how can the population of ashley be illustrated to show distribution across five years,,,Ambiguity found by gt only,,,Resolution found by gt only,,
"how likely is it that, if i was born in 2000, i was born in a county with no less than 20,000 people",Ambiguity found by both llm and gt,,,Resolution found by both llm and gt,,,0.5472535,0.45879972
give me the average population rating for ashley in the year 2000,,,Ambiguity found by gt only,,,Resolution found by gt only,,
identify the county that has the least population each year,,Ambiguity found by llm only,,,Resolution found by llm only,,,
what is the average population in 2000,,,Ambiguity found by gt only,,,Resolution found by gt only,,
is there a regional concentration trend in gdp development,Ambiguity found by both llm and gt,,,Resolution found by both llm and gt,,,0.5832967,0.16649786
how are gdp and mteu correlated,,,,,,,,
is there an outlier within the value distribution of albinism that causes the result to be skewed,,,,,,,,
"find all the types of genetic diseases with greater than 1,000 patients",,Ambiguity found by llm only,,,Resolution found by llm only,,,
tell me the maximum and minimum number of patients with autism across all regions,,,,,,,,
what is the spatial and temporal correlation of albinism,Ambiguity found by both llm and gt,,,Resolution found by both llm and gt,,,0.637537,0.49167842
does this data represent outliers in the number of patients,Ambiguity found by both llm and gt,,,,,Resolution found by gt only,0.25081322,
take out the regions with a number of patients larger than 500,,,,,,,,
"looking at the number of people in all regions with a visual impairment, what is the median",,,,,,,,
does the value distribution of albinism look skewed,,,,,,,,
is there an obvious clustering,Ambiguity found by both llm and gt,,,,,Resolution found by gt only,0.693756,
kindly rate the regions on the basis of the number of patients,,Ambiguity found by llm only,,,Resolution found by llm only,,,
give me the movie that received the most nominations,,,,,,,,
"out of the winners for best performance by an actor in a motion picture- musical or comedy from 2003 to 2020, the most abnormal age belongs to which actor",Ambiguity found by both llm and gt,,,Resolution found by both llm and gt,,,0.5236552,0.101105385
can you organize the results of the table by sorting the list according to the age of the stars,Ambiguity found by both llm and gt,,,,,Resolution found by gt only,0.5182226,
can you list all the results in the table about the movie ' about  ',,,,,,,,
what was the gender of all actors among all the final winners in the 60th ceremony,Ambiguity found by both llm and gt,,,Resolution found by both llm and gt,,,0.24707998,0.064246535
tell me who won the best performance by an actor in a motion picture- drama award at the 60th ceremony,,Ambiguity found by llm only,,,Resolution found by llm only,,,
can you list all the results in the table about the movie ' about schmidt ',,,,,,,,
i would like to review the dispersement of the amount of nominations,Ambiguity found by both llm and gt,,,Resolution found by both llm and gt,,,0.32551476,0.6459739
"in the 60th ceremony, the award for best performance by an actor in a motion picture was won by whom",,Ambiguity found by llm only,,,Resolution found by llm only,,,
which actor was nominated for the most awards,,,,,,,,
can the actors nationality impact the outcome,Ambiguity found by both llm and gt,,,Resolution found by both llm and gt,,,0.48908654,-0.057729077
what was the number of candidates that were nominated for best performance by an actor in a motion picture-drama at he 60th ceremony,,Ambiguity found by llm only,,,Resolution found by llm only,,,
what is the total number of movies released in the year 1998,,,,,,,,
can you tell me what movie won best original score in a motion picture in 1997,,,,,,,,
what is the correlation between the nomination and the age of a star,Ambiguity found by both llm and gt,,,,,Resolution found by gt only,0.64114267,
tell me the distribution for the book ratings,,,,,,,,
can you rearrange the table by book rating in descending order,,,,,,,,
what books have low ratings that seem suspect,Ambiguity found by both llm and gt,,,Resolution found by both llm and gt,,,0.62378633,0.66346264
tell me the book ratings distribution,,,,,,,,
which author has worked with dark horse comics most frequently,,Ambiguity found by llm only,,,,,,
please go and get all of the books written in english,,,,,,,,
are there outliers in the book ratings,,,,,,,,
"of fiction books, which are written in english",,,,,,,,
how many books have been released by dark horse comics,,,,,,,,
what is the most expensive book and who published it,,,Ambiguity found by gt only,,,Resolution found by gt only,,
show a list of similarly rated books,,Ambiguity found by llm only,,,Resolution found by llm only,,,
produce a list of book titles published during the current year,,Ambiguity found by llm only,,,Resolution found by llm only,,,
dark horse comic has how many books,,Ambiguity found by llm only,,,Resolution found by llm only,,,
what is the total number of categories,,,,,,,,
what's the size of ' kids paint free- drawing fun ',,,,,,,,
does a app exist that is much different than the others,Ambiguity found by both llm and gt,,,,Resolution found by llm only,,0.4908682,
what is the total amount of genres,,,,,,,,
what is the title of the biggest app,,Ambiguity found by llm only,,,Resolution found by llm only,,,
what apps have a perfect rating and a lot of reviews,,,Ambiguity found by gt only,,,Resolution found by gt only,,
see if you can locate the most recent gaming app,,Ambiguity found by llm only,,,Resolution found by llm only,,,
tell me free or paid apps have a higher mean rating,,,,,,,,
which genres are included in the dataset,,,,,,,,
which apps have support for versions of android lower than 40,,,,,,,,
describe shape of the distribution for the number of installations,,,,,,,,
show me the app that costs the most,,,,,,,,
is there a relationship between the android version of an app and its installations,,,,,,,,
show me the most recent version of androids ' discover color ',Ambiguity found by both llm and gt,,,,,Resolution found by gt only,0.881833,
"when taking different android versions into account, does that have any impact on installation",,,,,,,,
give me a list of all the free business apps that have received rating that were higher than a 45,,,,,,,,
can you tell me the attribute 'rating ' be affected 'installation,,,,,,,,
what's the price distribution in beauty apps,,Ambiguity found by llm only,,,Resolution found by llm only,,,
"which app has a rating that doesn 't follow a trend between installations, rating and number of reviews",,,,,,,,
what is the app with the most abnormal pattern,Ambiguity found by both llm and gt,,,Resolution found by both llm and gt,,,0.7803581,0.5979821
are there an unusually high number of reviews for any of the apps,,Ambiguity found by llm only,,,Resolution found by llm only,,,
what is the distribution of the number based on shape of installations,Ambiguity found by both llm and gt,,,Resolution found by both llm and gt,,,0.32843265,0.100052506
is there an effect on price caused by the app's genre,,Ambiguity found by llm only,,,Resolution found by llm only,,,
is there a correlation between apps with more installations and higher ratings,,,,,,,,
"tell me the most pricey apps by release date, recent to oldest",,,,,,,,
find out any app that is distinctive from the rest,Ambiguity found by both llm and gt,,,Resolution found by both llm and gt,,,0.5445216,0.43011642
list the top 10 gaming apps sorted from highest to lowest installations,,,,,,,,
can you tell me the price distribution of all the beauty apps,,Ambiguity found by llm only,,,Resolution found by llm only,,,
name any apps that can support any version of android lower than 40,,,,,,,,
what differences are there among the students who acquired more than 270 points between 2010-2019,Ambiguity found by both llm and gt,,,Resolution found by both llm and gt,,,0.46018606,0.3663317
tell me all of the categories of grade types,,,,,,,,
use the midterm exam and final exam as the 2nd and 1st keywords respectively in order to assign a rank to every one of the students,,Ambiguity found by llm only,,,Resolution found by llm only,,,
what did the majority of students receive as a grade,,,,,,,,
use the final exam as the first keyword and midterm exam as the second keyword to rank all the students,,Ambiguity found by llm only,,,Resolution found by llm only,,,
"show me the scope, among all the students, of the cw2 score",,Ambiguity found by llm only,,,Resolution found by llm only,,,
"in cw1, how many students achieved the feat of 100%, or full marks",,,,,,,,
rank the grades from highest to lowest according to the average score,,,,,,,,
can you tell me the median score of the cw1 class,,,,,,,,
do you know the median score of all students in cw1,,,,,,,,
how many students received an a,,,,,,,,
select all cw1 scores not less than 80%,,,,,,,,
arrange the students by grade and furnish me with a list,,,,,,,,
what is the distribution of the total points of the students,,,,,,,,
was the same midterm exam given to velma paul and glynis caine,Ambiguity found by both llm and gt,,,Resolution found by both llm and gt,,,0.13418609,0.18117386
what is the relationship between level of education and crime rate,Ambiguity found by both llm and gt,,,Resolution found by both llm and gt,,,0.6142372,0.41045064
are there any visible trends in violent crime rates over the time period,,,Ambiguity found by gt only,,,Resolution found by gt only,,
what is the most frequent place of violent crime,,,,,,,,
are there any correlations between crime types and geographic location,,,Ambiguity found by gt only,,,Resolution found by gt only,,
what is the distribution for non-violent crimes based on age,Ambiguity found by both llm and gt,,,Resolution found by both llm and gt,,,0.55648637,0.23385666
are there any correlations in violent or non-violent crimes based on congressional district and year,,,Ambiguity found by gt only,,,Resolution found by gt only,,
what city has the highest crime rate,Ambiguity found by both llm and gt,,,Resolution found by both llm and gt,,,0.67888814,0.47882915
what’s the frequency of gun violence incidents with multiple victims,,,,,,,,
how many gun violence incidents are there each year,,,,,,,,
are there any significant correlations between any 2 variables in the dataset,,,,,,,,
how many incidents of gun violence result in death (ie what proportion are fatal vs non-fatal),,,,,,,,
what鈥檚 the frequency of gun violence incidents with multiple victims,,,,,,,,
are males or females more likely to die of gun violence,,,,,,,,
how have homicide rates increased over time,,,,,,,,
what type of gun violence has seen the most growth over the years,,,,,,,,
are most gun death because of suicide,,,,,,,,
did most gun violence happen inside home,,Ambiguity found by llm only,,,Resolution found by llm only,,,
what is the correlation between education levels and suicide rates,,,,,,,,
which state/year has the most gun deaths,,,,,,,,
"according to population, what is the rank of each of region",,,,,,,,
what is the number of hospitals located in manyara,,,,,,,,
which 10 regions have the most health centers,,,,,,,,
look up regions that names start with the letter a,,,,,,,,
make a list of the number of total hfs in descending order,,,,,,,,
what is the average count of hospitals,,,,,,,,
what is the number of clinics that are in mara,,Ambiguity found by llm only,,,Resolution found by llm only,,,
what's the distribution of the entire hfs,,,Ambiguity found by gt only,,,Resolution found by gt only,,
which region has the lowest population ratio of hf,,,,,,,,
enter the regions from this table,,,,,,,,
look for the region that has the most people living in it,,,,,,,,
remove any regions with a population ratio of hf lower than 15,,,,,,,,
the population range needs to be discovered,,Ambiguity found by llm only,,,Resolution found by llm only,,,
do any regions have their population ratio over 20 hf,,,,,,,,
"when the score difference is more than 5, please list the extreme matches to this",,Ambiguity found by llm only,,,Resolution found by llm only,,,
please indicate the friendly tournament matches in which the home team beat the away team,,,,,,,,
tell me all the tournament matches that the home team won against the away team,,,,,,,,
which group of nations won the most games,,Ambiguity found by llm only,,,Resolution found by llm only,,,
"based on the number of matches, can you tell me what the distribution of cities is",,,,,,,,
what group of nations of have the most games,,Ambiguity found by llm only,,,Resolution found by llm only,,,
what countries have won a similar number of games,,Ambiguity found by llm only,,,Resolution found by llm only,,,
what is the propensity of the number of vehicles in japan and korea from the year 2000 to 2010,Ambiguity found by both llm and gt,,,,,Resolution found by gt only,0.46669215,
does life expectancy have any relation with the percentage of smokers,,,,,,,,
is the male to female ratio more imbalanced in the last decade in russia,Ambiguity found by both llm and gt,,,Resolution found by both llm and gt,,,0.6824281,0.32523796
is the speed of economic development relative to the population of each country,Ambiguity found by both llm and gt,,,Resolution found by both llm and gt,,,0.2779738,0.09185554
show me the gdp ranking of european countries,Ambiguity found by both llm and gt,,,,,Resolution found by gt only,0.40968803,
