mixtral_query,mixtral_positive match,mixtral_llm match,mixtral_gt match,mixtral_resolution positive match,mixtral_resolution llm match,mixtral_resolution gt match,mixtral_ambiguity similarity match,mixtral_resolution similarity match
"to cluster the states in the us, i wish to use middle income",,Ambiguity found by llm only,,,Resolution found by llm only,,,
do all the countries in africa have a lower average pci than all the countries in europe,Ambiguity found by both llm and gt,,,Resolution found by both llm and gt,,,0.31653568,0.08781324
could you tell me the continental location of the poorest ( lowest income ) country,,,Ambiguity found by gt only,,,Resolution found by gt only,,
"when looking at the average income in european countries, what is the variance",Ambiguity found by both llm and gt,,,Resolution found by both llm and gt,,,0.59397966,0.26192665
what are the minimum and maximum populations of the chinese provinces,Ambiguity found by both llm and gt,,,,,Resolution found by gt only,0.3580696,
what is the average height of the floors of these buildings,,,,,,,,
compare the number of tall buildings in hong kong with taiwan,,,,,,,,
compare the number of tall buildings in hong kong with taiwan,,,,,,,,
what location has the highest number of tall buildings,,,Ambiguity found by gt only,,,Resolution found by gt only,,
"provide the total sum of all the separated, divorced, and widowed people in lindi",,Ambiguity found by llm only,,,Resolution found by llm only,,,
does simiyu have a similar structure of peope as that of katavi,Ambiguity found by both llm and gt,,,Resolution found by both llm and gt,,,0.45188165,0.17240667
can you tell me how mara attributes are distributed,,Ambiguity found by llm only,,,Resolution found by llm only,,,
is the total attribute of one area equal to the sum of the other attributes in any area,,,,,,,,
relationship between imdb rating and rotten tomatoes rating,,,,,,,,
what's the production budget for movies in different years,,,,,,,,
movie gross and budget relationship based on genre,,Ambiguity found by llm only,,,Resolution found by llm only,,,
show me imdb rating versus rotten tomatoes rating,,,,,,,,
what creative type of movie had the highest production budget for each content rating,,,,,,,,
what is the relationship between production budget and worldwide gross for each major genre,,,,,,,,
what is the relationship between release year and average production budget,,,,,,,,
what major genre had the highest average worldwide gross,,,,,,,,
what major genre had the lowest average worldwide gross,,,,,,,,
how much did average worldwide gross vary by major genre,,,,,,,,
how many movies are there are of each creative type,,,,,,,,
which creative type had the most movies,,,,,,,,
which creative type had the fewest movies,,,,,,,,
what is the total worldwide gross for each major genre across time,,Ambiguity found by llm only,,,Resolution found by llm only,,,
is there a relationship between production budget and worldwide gross for each content rating,,,,,,,,
what is the distribution of running times for each movie,,,,,,,,
is there a relationship between imdb rating and rotten tomatoes rating,,,,,,,,
movie run time distribution,,,,,,,,
how production budget changes over release years,,,,,,,,
what was the average production budget of movies by year,,,,,,,,
"what's the average production budget of the different rated movies, separated by creative type",,,Ambiguity found by gt only,,,Resolution found by gt only,,
which genre movie makes most worldwide gross,,,,,,,,
are imdb rating and rotten tomatoes rating related,,,,,,,,
what is the worldwide gross distribution per genre,,Ambiguity found by llm only,,,Resolution found by llm only,,,
what's the breakdown of production budget by creative type per content rating,,Ambiguity found by llm only,,,Resolution found by llm only,,,
how does rotten tomatoes rating change as imdb rating,,,,,,,,
what is the total worldwide gross earned by each major genre and content rating,,,,,,,,
"for each genre and rating, what is the total world-wide gross earnings",,Ambiguity found by llm only,,,Resolution found by llm only,,,
how much did each type of movie earn in across the whole world,,,,,,,,
how much money did movies of each genre and rating make,,,,,,,,
"what was the average budget for each content rating and creative type, as multiple column charts",,Ambiguity found by llm only,,,Resolution found by llm only,,,
what is the average production budget in each year,,,,,,,,
compare imdb rating to rotten tomatoes rating,,Ambiguity found by llm only,,,Resolution found by llm only,,,
which creative types have the most movies,,Ambiguity found by llm only,,,Resolution found by llm only,,,
"on average, how much was earned by movies of each genre",,Ambiguity found by llm only,,,Resolution found by llm only,,,
how many movies are of each length,,,,,,,,
help me see outliers in imdb and rotten tomatoes ratings,,,,,,,,
what was the average worldwide gross of movies by genre,,,,,,,,
how much did major genres gross in total,,Ambiguity found by llm only,,,Resolution found by llm only,,,
gross across genres regarding content rating,,Ambiguity found by llm only,,,Resolution found by llm only,,,
what's the distribution of running times by movie,,,,,,,,
how many movies are there in 20 minute bins of running time,,Ambiguity found by llm only,,,Resolution found by llm only,,,
how many movies are there for each creative type,,,,,,,,
show me the variation in the amount ordered by different entities in different orders,Ambiguity found by both llm and gt,,,Resolution found by both llm and gt,,,0.48717117,0.14361367
worldwide gross for each genre for each year 1995 to now,,Ambiguity found by llm only,,,Resolution found by llm only,,,
"cumulative gross for each content rating, by major genre",,,,,,,,
relation between worldwide gross and production budget for each major genre,,,,,,,,
which position has the highest average of playing time,,,Ambiguity found by gt only,,,Resolution found by gt only,,
name movies released in 2017,,,,,,,,
is the normal distribuition satisfied by the length of the movies,,,,,,,,
sort the movies by length,,,,,,,,
how long is the run time of average r-rated movies,,,Ambiguity found by gt only,,,Resolution found by gt only,,
give me the numbers of movies that were released in 2017,,,,,,,,
is there an average run time for movies,,,,,,,,
is the running time of movies recently longer than it used to be,,,,,,,,
do movie tags and duration have a connection,,,Ambiguity found by gt only,,,Resolution found by gt only,,
determine if the running time of movies has increased in recent years,,Ambiguity found by llm only,,,Resolution found by llm only,,,
show me the dates that netflix released movies,,,Ambiguity found by gt only,,,Resolution found by gt only,,
does any movies not have a description,,,,,,,,
at what point was data added to the table for netflix,,,Ambiguity found by gt only,,,Resolution found by gt only,,
"what is the percentage of the white population in blount county, alabama",,,,,,,,
"what percentage of the blount county, alabama population is white",,,,,,,,
sort all the counties in connecticut by the percentages of the hispanic population,,Ambiguity found by llm only,,,Resolution found by llm only,,,
tell me which county has the greatest number of female residents,,,,,,,,
calculate the average black population for each state,,,,,,,,
i want to see the distribution of the school rankings in geita in 2006,,Ambiguity found by llm only,,,Resolution found by llm only,,,
do the pass rate and the ownership of schools have any correlation,,,,,,,,
create a list of schools showing the descending order by change_p,,,,,,,,
can you provide a list of school names in geita,,,,,,,,
determine if there are any schools in neighboring regions that have similar avg_m,,Ambiguity found by llm only,,,Resolution found by llm only,,,
list the values of kwema modern pr school's change_p in all the years,,Ambiguity found by llm only,,,Resolution found by llm only,,,
what schools have similar avg_m in the neighboring region,,Ambiguity found by llm only,,,Resolution found by llm only,,,
which of these school have a pass rate of over 90,,,,,,,,
they want to know what tactic is most effective during football,Ambiguity found by both llm and gt,,,Resolution found by both llm and gt,,,0.4093734,0.5050049
were you aware of the most recent news,Ambiguity found by both llm and gt,,,,,Resolution found by gt only,0.8891614,
the clubs should be arranged by their shooting attempts,,,Ambiguity found by gt only,,,Resolution found by gt only,,
what was the total amount of goals scored in the game that liverpool played in,,Ambiguity found by llm only,,,,,,
the games are sorted by experts by their date,,,Ambiguity found by gt only,,,Resolution found by gt only,,
rank these clubs by their shooting attempts,Ambiguity found by both llm and gt,,,Resolution found by both llm and gt,,,0.54194355,0.3700407
are the students who are younger more likely to use wechat,,,,,,,,
can lower study times among students cause greater failure rates in class,,,,,,,,
can you name an unusual reason for choosing this school,,,,,,,,
could you show me the list sorted by study time ( longest to shortest ),,,,,,,,
find the distribution by age,,,,,,,,
can you tell me which students have fathers that are teachers,,,,,,,,
retrieve the students with fathers who work as teachers,,,,,,,,
tell me the youngest students in the dataset,,,,,,,,
tell me the types of jobs the student's mothers have,,,,,,,,
i 'm wondering would the travel time decrease for students if they spent more time studying,,Ambiguity found by llm only,,,Resolution found by llm only,,,
would more time spent on studying reduce travel time for students,,,,,,,,
do countries with high populations wish to slow down population growth,Ambiguity found by both llm and gt,,,Resolution found by both llm and gt,,,0.67173696,0.12789395
can you tell me the state which may have the largest average population in the next year,,Ambiguity found by llm only,,,Resolution found by llm only,,,
can you see any abnormalities in the suicide rates,,,,,,,,
name the country with the lowest suicide rate,,,,,,,,
do you know the average number of suicides in europe,Ambiguity found by both llm and gt,,,Resolution found by both llm and gt,,,0.48547542,0.36141285
are there any countries with anomalously low suicides rates,,Ambiguity found by llm only,,,Resolution found by llm only,,,
is there similarities between gdp per capita and suicide rates,,,,,,,,
were there any countries with abnormally low suicide rates,,Ambiguity found by llm only,,,Resolution found by llm only,,,
"with the suicide larger than 100, determine the ages in albania",,,,,,,,
the country with the lowest suicide rate is,,,,,,,,
what is the distribution rate of suicide,,Ambiguity found by llm only,,,Resolution found by llm only,,,
what is the total number of all suicides in 1999,,,,,,,,
would there be any clustering of countries in terms of suicide rates,,Ambiguity found by llm only,,,Resolution found by llm only,,,
create a list showing the ages of people who committed suicide in albania,,,,,,,,
"for the gdp of china, has it gone up or down over the last decade",,Ambiguity found by llm only,,,Resolution found by llm only,,,
"of all countries, how is the gdp distribution",,,,,,,,
has there been an increase or decrease in the gdp of china over the last 10 years,,Ambiguity found by llm only,,,,,,
how much is the average of profit of each state,,Ambiguity found by llm only,,,Resolution found by llm only,,,
how do the company earn in each state,,,,,,,,
what were the total sales for each date in each category,,Ambiguity found by llm only,,,Resolution found by llm only,,,
how much was sold each day for each category,,Ambiguity found by llm only,,,Resolution found by llm only,,,
what is the average profit for each state,,Ambiguity found by llm only,,,Resolution found by llm only,,,
what is the relationship between profit and sales,,,,,,,,
what is the average profit of each ship mode divided by segment,,,,,,,,
what is the sales forecast for each date,,Ambiguity found by llm only,,,Resolution found by llm only,,,
how many orders were placed for each order quantity,,,,,,,,
what is the relationship between sales and profit for each region,,,,,,,,
how many orders were placed for each sub-category,,,,,,,,
"what is the total profit for each region, based on ship status",,,,,,,,
what is the sales trend of the different product categories,,Ambiguity found by llm only,,,Resolution found by llm only,,,
how many products have 3 or more quantity ordered,,,,,,,,
how many products are ordered in single quantity,,,,,,,,
density of sales across regions and their profitability,,Ambiguity found by llm only,,,Resolution found by llm only,,,
what are the profits across different states,,,,,,,,
what product category has more orders placed,,Ambiguity found by llm only,,,Resolution found by llm only,,,
sales forecast between jan 2016 and july 2017,,Ambiguity found by llm only,,,Resolution found by llm only,,,
i want to know how many orders there are by the quantity of the order,,,Ambiguity found by gt only,,,Resolution found by gt only,,
what is our profit based on shipping mode by customer segment,,,,,,,,
what is the sales vs profit ratio of the four regions,,,,,,,,
what is the average profit of each state,,Ambiguity found by llm only,,,Resolution found by llm only,,,
what is the sales vs profit ratio of all the zones,,Ambiguity found by llm only,,,Resolution found by llm only,,,
what is the average profit of different segments on the ship modes of transport,,,,,,,,
how much is the profit for sales for each,,Ambiguity found by llm only,,,Resolution found by llm only,,,
what is the correlation between sales and profit by region,,,,,,,,
can you create a graph showing sales and profit by region,,,,,,,,
"from all of the universities in london, list the one who has the most faculties",Ambiguity found by both llm and gt,,,,Resolution found by llm only,,0.44438404,
show me a university that has more than 30 faculties and more than 50 teachers,Ambiguity found by both llm and gt,,,Resolution found by both llm and gt,,,0.4655035,0.5614363
universities with similar number of teachers,,Ambiguity found by llm only,,,Resolution found by llm only,,,
"from all of the universities in london, list the one who has the most faculties",Ambiguity found by both llm and gt,,,,Resolution found by llm only,,0.44438404,
the universities cover which locations,,,,,,,,
what is the teacher distribution of new york universities,,Ambiguity found by llm only,,,Resolution found by llm only,,,
would teachers in harvard be considered outliers if the university was in new york,Ambiguity found by both llm and gt,,,Resolution found by both llm and gt,,,0.5886358,0.08480399
what is the number of divisions in harvard university,,,Ambiguity found by gt only,,,Resolution found by gt only,,
which movie is the highest-grossing,,,,,,,,
do you feel that midfield players have a lower market value than front court players,,,Ambiguity found by gt only,,,Resolution found by gt only,,
can you tell me if there is a correlation between revenue and the release year,,,,,,,,
is there a typical film lengths group,Ambiguity found by both llm and gt,,,,,Resolution found by gt only,0.62002337,
in the premier league how are the transferred players ages distributed,,,,,,,,
tell me a reason why top backcourt players have a higher market value than the top frontcourt player,,Ambiguity found by llm only,,,,,,
which player had an abnormal transfer_fee,,,,,,,,
how old was david when he was transferred in 2010,,,,,,,,
"what player had a market value of 50,000,000 and was transferred for 58,500,000 in the 2010鈥毭劽011",,,,,,,,
"for the center forward position, what was the highest market value for the 2011-2012 season",,,,,,,,
tell me the numbers of the transferred players in different leagues in the 2010-2011 season,,,,,,,,
"what player had a market value of 50,000,000 and was transferred for 58,500,000 in the 2010‚äì2011",,,,,,,,
could you buy a player with his market value higher than a transfer fee,,,,,,,,
what is the average transfer_fee for players who transferred to the premier league,,,,,,,,
list center-backs by what their transfer_fee was,,,,,,,,
which player was the oldest that was transferred,,,,,,,,
what is the distribution of the leagues who paid for transferred players in 2010,,Ambiguity found by llm only,,,Resolution found by llm only,,,
are you aware of any clustering of the seasons in which players were transferred to the premier league,,,,,,,,
"if you were to average it out, how upbeat would you say the songs are",,,,,,,,
describe the popularity of the loudest song,,,,,,,,
can you help me find some popular songs,,,,,,,,
"in terms of length, how long is ' beautiful people '",,,,,,,,
what songs of the pop genrea has sam smith released,,,,,,,,
are there singers who span multiple genres,,,,,,,,
determine in what year the income of undergraduate students was higher,,Ambiguity found by llm only,,,Resolution found by llm only,,,
how are postgraduate student numbers distributed every year,,,,,,,,
could you tell me if there is any correlation between the number of undergraduate and postgraduate students,,,,,,,,
state the average income of postgraduate students in each country,,,,,,,,
what is the number of postgraduate students for each year,,,,,,,,
"in each year, what is the distribution of the number of postgraduates",,,,,,,,
the chart teaches them the horsepower range,,,,,,,,
name me a country that's happiness score does not coincide with the region it belongs to,,Ambiguity found by llm only,,,Resolution found by llm only,,,
tell me the country with the lowest trust score,,,,,,,,
is there a correlation between happiness scores and other attributes,,Ambiguity found by llm only,,,Resolution found by llm only,,,
"what countries, other than finland, have higher happiness scores and lower gdp",,,,,,,,
can you tell me the area in the previous decade that increased rapidly in the happiness score,Ambiguity found by both llm and gt,,,,,Resolution found by gt only,0.39590275,
"can you tell me, in terms of economy, what is the range across all countries",,,,,,,,
show me any clustering there may be in the gdp that has a happiness score of larger than 5,,Ambiguity found by llm only,,,Resolution found by llm only,,,
within the last year have any countries experienced a sudden decrease in happiness score,Ambiguity found by both llm and gt,,,Resolution found by both llm and gt,,,0.3384187,0.19058388
can you tell me the range of happiness score in western europe,,,,,,,,
"out of all the countries, which ones have a happiness score higher then finland",,,,,,,,
can you tell me in what range will the number of countries in each region fall,,,,,,,,
please identify the parameters of the happiness score in western europe,,,,,,,,
show all the countries with happiness scores higher than 5,,,,,,,,
name the continent that contains the greatest number of countries that are top 10 on the happiness index,,,,,,,,
do any countries have happiness scores that don 't match with their gdp,,Ambiguity found by llm only,,,Resolution found by llm only,,,
"of all the countries trust score, which country has the lowest",,,,,,,,
name the country that scores the least on trust,,,,,,,,
what is the range across all the countries in terms of economy,,,,,,,,
"organize the countries based on happiness score, with the score limit on each group being 10",Ambiguity found by both llm and gt,,,,Resolution found by llm only,,0.42466563,
show me the distribution of the health score as it is presented in different regions,,,,,,,,
tell me the average gdp of countries in western europe,,,,,,,,
organize the countries by their region,,,,,,,,
"for all the regions, can you show me the pattern of the happiness score",,Ambiguity found by llm only,,,Resolution found by llm only,,,
what are all the countries that have a happiness score similar to fineland 5 is an acceptable error score,,,,,,,,
what is the range of economy across all the countries,,,,,,,,
rank countries high to low by their family score,,,,,,,,
can we conclude that higher happiness comes from higher freedom,,,,,,,,
what dimension of the happiness index has the maximum fluctuation,Ambiguity found by both llm and gt,,,,Resolution found by llm only,,0.35411268,
retrieve the country that has had a sudden decrease in happiness score within a year,,Ambiguity found by llm only,,,Resolution found by llm only,,,
"across all regions, what is the happiness score pattern",,Ambiguity found by llm only,,,Resolution found by llm only,,,
the health score is highest in which country,,,,,,,,
the highest health score is held by which country,,,,,,,,
please help me identify the least common age,,,,,,,,
